api_key,app_name,app_store_url,app_details,app_submission_created_at,integrations
2414776,Yagi Order Cancellable - Yagi Order Cancellable -let customer  cancel order easily,https://apps.shopify.com/cancellable,"This app allows customers to cancel and reorder easily on the order thank you / status page, customer account page, and order confirmation email, saving time",2025-04-21 23:50:17+00:00,"Shopify Flow,Customer Hub,Customer accounts,Checkout"
2875965,"BXYZ Bundles Quantity Breaks - Product bundles, quantity breaks & automatic upsell popups",https://apps.shopify.com/bxyz,"Sell more with product bundles, quantity break and mix & match automatic discounts and discount codes, and automatic upsell popups—Seamless Shopify Integration",2025-04-21 23:50:44+00:00,"Cart,Checkout"
9829758,S:Request a Quote & Hide Price - Request a Quote & Hide price app for Shopify stores,https://apps.shopify.com/storeify-request-a-quote,Easily interact with customers regarding best prices for products with Request a Quote & Hide Price,2025-04-21 23:51:04+00:00,"Omnisend & Active Campaign,Mailchimp & Klaviyo,Contact Form Builder,Google Sheets & reCaptcha,GetResponse & Campaign Monitor"
4557390,GLS France - Tous les services GLS France disponibles pour votre boutique,https://apps.shopify.com/gls-france,"Tous les services GLS France sont intégrés : Business Parcel, FlexDelivery, Relais GLS, Express. Proposez le chargement en temps réel des Relais GL...",2025-04-21 23:51:21+00:00,"Customer accounts,Checkout"
5733253,Bundler ‑ Product Bundles - Bundle app for Shopify in 2025,https://apps.shopify.com/bundler-product-bundles,Offer bundles in Shopify with discounts and boost your sales in your online store.,2025-04-21 23:51:37+00:00,"Seal Subscriptions,Cartbot: Gift with purchase,Point of sale (POS),Shopify POS,Multicurrency converter apps,Subscription options,PageFly Landing Page Builder,Checkout"
2124752,"Search Magic - Affordable, featured-packed search for mobile and desktop.",https://apps.shopify.com/search-magic,"Search Magic is a simple-to-install, feature-packed search solution that is designed to connect your shoppers with the products they’re looking for...",2025-04-21 23:51:44+00:00,"stamped.io,judge.me"
3365245,BLP Referral Program Affiliate - BLOOP Referral & Affiliate Marketing,https://apps.shopify.com/bloop-referral-program,"BLOOP Referral & Affiliate Marketing empowers merchants with easy-to-use tools to reward referrals and affiliates, boosting sales and customer loyalty.",2025-04-21 23:51:59+00:00,"BLOY,Klaviyo,Checkout"
1164258,Complect Fulfill: CargoWise - Complect Fulfill for CargoWise,https://apps.shopify.com/complect-fulfill-cargowise,Connect your store to CargoWise for seamless order fulfillment with your 3PL partner. Automate order fulfillment & shipment updates while eliminating errors.,2025-04-21 23:52:07+00:00,CargoWise
4857423,"Export Flow Automation: Mipler - Create data automation flows - export, transform and cleanup",https://apps.shopify.com/mipler-flow,"Mipler Flow is an automation tool designed for all kinds of data-related tasks: - Exporting, blending, cleaning, transforming, and analyzing data f...",2025-04-21 23:52:31+00:00,"SQL,Google Sheets,Slack"
4298473,Attentive: SMS + MMS Marketing - SMS marketing built to help e-commerce brands increase revenue,https://apps.shopify.com/attentive,"Build a Winning Strategy: Refine your SMS strategy as you scale with playbooks, expert advice, and guidance from our industry-leading team. Prewrit...",2025-04-21 23:53:01+00:00,"LoyaltyLion,Okendo,Zendesk,Rebuy,Gorgias,Loop Returns,Checkout"
2755975,Entafix: Catch First Visit - Catch first-time visits & give them discount codes with pop-up,https://apps.shopify.com/entafix-catch-first-visit,"Catch First Visit application, based on the terms and scenario you define, allows you to provide first-time visitors to your site with a discount c...",2025-04-21 23:53:15+00:00,Countdown Timer
6584459,Cargowale Shipping - Cargowale Shipping: Efficient and Cost-Effective E-Commerce,https://apps.shopify.com/cargowale-shipping,"Cargowale Shipping offers a seamless shipping experience for e-commerce businesses, providing efficient management of shipments with real-time tracking",2025-04-21 23:53:28+00:00,"Blue Dart,Movin,Ecom Express,Delhivery,DTDC"
8625247,Firehonor Group Buying - Firehonor Group Buying for Shopify,https://apps.shopify.com/firehonor-group-buying,"Boost sales with our powerful group buying app! Create tiered and referral deals, allowing users to invite friends and increase engagement.",2025-04-21 23:54:02+00:00,"Customer accounts,Checkout"
9612889,"Open SignIn ‑ Social Login - Easily use Facebook, Google etc to Signin/ Signup to the...",https://apps.shopify.com/open-signin,Customer signin / signup using various third party authentication services helps in increased customer registrations and customer retention. The ap...,2025-04-21 23:54:24+00:00,"Google,Amazon,Yahoo,Twitter,Facebook,LinkedIn"
5765479,OTO ‑ Shipping Gateway - OTO - #1 Shipping Gateway in Shopify for MENA &...,https://apps.shopify.com/oto,"Streamline shipping with OTO! Retailers in KSA, UAE, and Turkey can ship, manage, track, and return orders globally with ease. Easily connect your Shopify store",2025-04-21 23:54:51+00:00,"SMSA,DHL,MNG,ERP,Aramex,Yurtiçi Kargo"
1747943,#BookKeeper - Dagens salg bogført simpelt og nemt,https://apps.shopify.com/bookkeeper-1,"BookKeeper gør det nemt at overføre dagens totale salg til Billy, Dinero eller e-conomic. Funktioner inkluderer automatisk synkronisering og godken...",2025-04-21 23:55:00+00:00,"Billy,e-conomic,Dinero"
2135973,Excel Post Purchase - Seamless post-purchase upgrades with custom messaging.,https://apps.shopify.com/excel-post-purchase,"This app allows merchants to provide targeted post-purchase upgrades. Ideal for merchants with multi-tier products, it lets customers seamlessly sw...",2025-04-21 23:55:29+00:00,Checkout
3795039,EcomLovin ‑ My Digital Product - Effortlessly sell and deliver digital content to customers,https://apps.shopify.com/my-digital-product,"My Digital Product simplifies selling and delivering digital products like ebooks, PDFs, and videos. My Digital Product automates file delivery, en...",2025-04-21 23:55:37+00:00,Customer accounts
4449863,Urgency Sales Booster - Increasing your AOV with urgency sales booster in your store,https://apps.shopify.com/urgency3-in-1,"Increasing your average order value by providing free-shipping bars to reach specific goals, or creating sticky checkout button to ease the buying process.",2025-04-21 23:56:03+00:00,"Pop-ups,Pixels,WinAds"
4126406,Subuno - Credit card fraud & chargeback fraud prevention,https://apps.shopify.com/app70418,Subuno helps e-commerce merchants prevent credit card fraud. Automate your fraud prevention order screening by setting up customized rules.,2025-04-21 23:56:19+00:00,"email data analytics,Ship-forwarding addresses,phone/address/name analytics,phone data analytics,IP data analytics,BIN analytics"
6130208,Shopify Subscriptions - Drive more sales with subscriptions,https://apps.shopify.com/shopify-subscriptions,Give your customers the option to receive the products they love on a regular basis by offering subscriptions on your store. Whether you sell all y...,2025-04-21 23:56:34+00:00,"Customer accounts,Checkout"
8236588,Snackeet,https://apps.shopify.com/snackeet,"Une app stories complète : vidéos, landing page, web stories, CGU, quiz, sondages, jeux",2025-04-21 23:57:06+00:00,"Active Campaign,Klaviyo,Google,Brevo"
3934354,Redshelf Integration - Create Ebook via Redshelf,https://apps.shopify.com/redshelf-integration,This app integrates with Redshelf. All you need for this app is the hash id and access token. The app verifies user-provided information. If the in...,2025-04-21 23:57:13+00:00,redshelf
4113798,Delivery Boy - Seamless delivery management with live tracking and updates,https://apps.shopify.com/delivery-boy,"To simplify the door-to-door process, delivery agents are needed who can take care of your deliveries and manage them in a sorted way.  The app all...",2025-04-21 23:57:18+00:00,"mobikul mobile app builder,multi vendor marketplace"
9648956,Mega WhatsApp Button - Add a Customizable WhatsApp Button to Your Shopify Store,https://apps.shopify.com/mega-whatsapp-button,Instantly connect with customers on WhatsApp. Add a customizable floating chat button to your Shopify store today and boost your sale,2025-04-21 23:57:39+00:00,WhatsApp
1875415,配送日時指定くん,https://apps.shopify.com/shopify-application-455,"このアプリは、商品購入時に必要な配送日設定を柔軟にカスタマイズできる機能を提供します。主な機能として、配送日や配送時間の設定が可能です。

最短および最長の配送希望日を自由に設定でき、購入者が適切な配送日を選択できるように調整できます。また、店舗の休業日を事前に登録することで、出荷や配送が行え...",2025-04-21 23:57:46+00:00,Checkout
9217245,goadgo ‑ Affiliate Marketing - goadgo: Affiliate Marketing Solution For Your Store,https://apps.shopify.com/goadgo,"With goadgo, you can easily carry out your Affiliate Marketing activities from your store and increase both your brand awareness and income.",2025-04-21 23:57:54+00:00,Checkout
8396862,WhatsApp Button by EAZE - Easily let your customers contact you through WhatsApp,https://apps.shopify.com/whatsapp-button-1,"The app adds a chat button for WhatsApp to your shop. If a customer has a question or would like to contact your shop, he can easily click on the b...",2025-04-21 23:58:04+00:00,"Facebook,Google Analytics,WhatsApp"
2643716,"Conversios ServerSide Tracking - Server-Side Tracking for GA4, Google Ads & Meta – No...",https://apps.shopify.com/conversios-server-side-tagging,"Enable server-side tracking for GA4, Google Ads, and Meta. Improve data accuracy, attribution, and event tracking without writing any code.",2025-04-21 23:58:33+00:00,"Google Analytics 4,Google Cloud Platform,Meta (Facebook) Conversion API,Google Ads,Google Tag Manager,Checkout - Customer Events"
3930575,ふりがな入力欄 ‑ チェックアウト,https://apps.shopify.com/tkllc-furigana-input,チェックアウトの配送先住所の入力に「ふりがな」の入力欄を追加します。入力された「ふりがな」は注文の「追加の詳細」欄でご確認いただけます。,2025-04-21 23:58:38+00:00,Checkout
7001208,Smoothify: Smooth scroll - Smoothly - The smoothest scroll on Shopify,https://apps.shopify.com/smoothify-smooth-scroll,"Enhance your Shopify store with Smoothify! Seamless smooth scrolling for a sleek, user-friendly shopping experience. Install now for instant site improvement!",2025-04-21 23:58:47+00:00,"Email Pop Ups,All Theme Support,Translation Apps,Currency Convertors,Review Widgets,Landing Page Builder"
3796201,Mediaclip Hub - Mediaclip Web2Print editor for POD Custom Products,https://apps.shopify.com/mediaclip-hub,"Embedded online solution for Shopify merchants to create, print and sell any type personalized product. Increase revenues and customer lifetime values.",2025-04-21 23:59:02+00:00,"Picsart,Instagram,Order Fulfillment Workflows,Facebook,EyeQ Perfectly Clear,Google Photos,Checkout"
3638946,WhatsApp by Klinko - Easily integrate WhatsApp with your Shopify store.,https://apps.shopify.com/klinko,Enhance your sales with Smart Automated Messages via WhatsApp! Strengthen connections and improve conversions by sending key events from your e-commerce store.,2025-04-21 23:59:16+00:00,WhatsApp
7779906,Dext Commerce - QuickBooks or Xero Sync by Dext Commerce,https://apps.shopify.com/dext-greenback,Dext Commerce automates accounting for Shopify stores worldwide using Xero & QuickBooks. Leading e-commerce accounting firms trust us to automate manual work.,2025-04-21 23:59:24+00:00,"Amazon Seller,Walmart Marketplace,PayPal,Etsy,Stripe,eBay"
4440763,Syncjob - Syncjob – Multi-Channel Stock & Order Synchronization,https://apps.shopify.com/syncjob,"Syncjob syncs inventory & orders across Shopify, Amazon, Bol.com, Kaufland & more. Prevent overselling, automate stock updates & streamline order management.",2025-04-21 23:59:30+00:00,"Magento,Amazon,Kaufland,Mirakl,ExactOnline,Bol.com"
7697134,Jump: Affiliate Storefronts  - Premium Affiliate Marketing Tools,https://apps.shopify.com/jump,"Imagine giving your affiliates the power to select which products, promo codes, and TikTok videos they want to showcase on their storefront. Now you can.",2025-04-21 23:59:39+00:00,"PayPal,Klaviyo,SendLane,Checkout"
4534333,Afluencer Influencer Collabs - Influencer Marketing for Shopify: Find Influencers Here,https://apps.shopify.com/afluencer,Easy influencer marketing for Shopify stores. Find influencers and creators to promote your products here.,2025-04-21 23:59:45+00:00,"facebook,tiktok,twitter,youtube,instagram"
4306495,"SMARTT Shipping - Access Exclusive Discounts: Ship Smarter, Save More",https://apps.shopify.com/smarttshipping,"The single most important shipping asset for your business is SMARTT Shipping. Delivering unmatched efficiency, reliability, and cost-effectiveness...",2025-04-22 00:00:15+00:00,"DHL,100+ Carriers,Loomis,FedEx,UPS,Canada Post"
6449521,Streamline - Reduce stockouts and excess inventory,https://apps.shopify.com/gmdh-streamline,"Get an unfair advantage in your decision-making with our integrated demand planning & forecasting solution. Collaborate, track performance, and for...",2025-04-22 00:00:22+00:00,"Built-in ERP connectors,Spreadsheet,Database,Custom API"
4137784,Jebbit: Quizzes That Convert - Jebbit: Supercharge Your Shopify Store with Quizzes,https://apps.shopify.com/jebbit,"Unlock your store's full potential with Jebbit. Create beautiful, interactive experiences that captivate visitors, gather insights, and boost conversions.",2025-04-22 00:00:29+00:00,"Yotpo,Klaviyo,Hubspot,Facebook,Google Tag Manager,Attentive"
2926114,Appointment Booking App ointo,https://apps.shopify.com/appointo-appointments-and-bookings,Appointment Booking app lets you take bookings and appointments directly from your Shopify website. Connect your calendar and setup your services in 2 minutes.,2025-04-22 00:00:38+00:00,"Appointment,appointment booking,Shopify POS,Zoom,Calendly,Calendar,Booking,Checkout"
7164296,"通途刊登 - 刊登,Listing,商品管理,产品管理,上架,修改数量",https://apps.shopify.com/tongtool_listing,"数据采集
支持60+平台站点采集，采集内容直接上架，省时省力省人工

产品资料中心
产品资料中心化管理，一键上架

迁移搬家
支持同平台、跨平台产品资料迁移搬家，助力买家快速开拓新站点、新店铺

自动防超卖
同产品多Listing共享库存，库存变动自动同步到线上Listing，防超卖不再是难事...",2025-04-22 00:00:51+00:00,"wish,shopee,Amazon,aliexpress,joom,eBay"
5565160,"Cálculo de Frete Inteligente - Cálculo de frete para Correios, CheckStore e Platinum Log",https://apps.shopify.com/smart-shipping-calculation,"Compatível com os plano Plus, Advanced ou Shopify no pagamento anual. Com o Cálculo de Frete da FullComm, sua loja não para de vender quando seu ga...",2025-04-22 00:00:58+00:00,"platinum,Correios,CheckStore,importação de planilha,Checkout"
3350434,TPM Weightify - Streamline product entry by weight for a seamless POS flow.,https://apps.shopify.com/tpm-weightify,"TPM Weightify is a Shopify app that simplifies the POS process for merchants selling products by weight, such as grocery stores and delis. It impro...",2025-04-22 00:01:04+00:00,Shopify POS
9956167,enventa DIAMOD Connector - Verbinden Sie das enventa DIAMOD ERP (ehemals Texdata),https://apps.shopify.com/enventa-fashion-diamod,Die App ermöglicht die vollständige Synchronisation Ihrer Unternehmensprozesse zwischen Ihrem Onlineshop und dem DIAMOD ERP. Zu den automatisiert ü ...,2025-04-22 00:01:10+00:00,enventa DIAMOD ERP
1415644,autoWindex - AI-Powered SEO & Instant Search Engine Submissions,https://apps.shopify.com/autowindex,"AI-powered SEO automation for instant Google and Bing (IndexNow) submissions. Improve search visibility, speed up indexing, and keep your store content fresh",2025-04-22 00:01:28+00:00,"Google,OpenAI,IndexNow,Yandex,Microsoft Bing,Chat GPT"
2734327,SureCust ‑ Wishlist - SureCust - Wishlist app,https://apps.shopify.com/surecust-wishlist,"SureCust - Wishlist: The smoothest, fastest, and simplest wishlist app for effortless customer use.",2025-04-22 00:01:35+00:00,"Customer accounts,Checkout"
9174513,Tag Concierge GTM Tracking - Seamless ecommerce tracking tool.,https://apps.shopify.com/tag-concierge-gtm,This app pushes complete e-commerce events and data – GA4 eCommerce compatible – to Google Tag Manager Data Layer. Once this information is availab...,2025-04-22 00:01:42+00:00,Checkout
8816212,"Local Delivery Date by SpurIT - NearBuy: Local Delivery, Pickup, and Delivery Date App",https://apps.shopify.com/delivery-date-3,"Attract new customers by offering delivery & pickup on your store. The app allows you to specify unlimited locations, delivery areas, delivery fees & conditions",2025-04-22 00:01:50+00:00,Customer accounts
4684020,Servv: Events Booking App - Servv AI - Events Bookings app for Shopify,https://apps.shopify.com/servv,"Servv AI is a Shopify Events Booking platform helps you increase sales by creating Online & InPerson Events,  Appointment Bookings, Webinars & Recordings.",2025-04-22 00:01:59+00:00,"Zoom,Google Calendar"
9261221,Flash Cart‑ Drawer Cross‑sells - Flash Cart,https://apps.shopify.com/flash-cart,Extend the functionality of your cart with highly customizable components designed to boost conversions.,2025-04-22 00:02:07+00:00,"Subscriptions,Weglot,Multi-language,Geolocation,Popular themes,Multi-currency"
7307142,"King Checkout Validation - Block Unwanted Checkout based on address, cart and customer.",https://apps.shopify.com/king-checkout-validation,"Validates cart, address, customer info. Implements VAT, house number, apartment checks, length checks, smart matching. reduces returns. Defines shopping future.",2025-04-22 00:02:35+00:00,Checkout
2463932,"Assortion: Upsell & Bundles - Create product bundles, volume discount, and upsell offers",https://apps.shopify.com/assortion,"Assortion is a one-stop-shop for all your upsell and cross-sell needs. Instead of using 5 different apps with separate integration, analytics, lear...",2025-04-22 00:02:44+00:00,Checkout
7697883,Zapiet ‑ Pickup + Delivery - Zapiet - Local Pickup & Local Delivery for Shopify,https://apps.shopify.com/click-and-collect,"Optimize your Shopify store with our app for local pickup, store pickup, local delivery, and curbside pickup. Improve order management and customer satisfaction",2025-04-22 00:02:52+00:00,"Exportify,Roadie,Recharge,Zapier,Shopify POS,Shopify Flow,Customer accounts,Google Calendar,Checkout"
1530968,FormCRM: AI Form Builder & CRM - Create Forms in Seconds,https://apps.shopify.com/ai-form-builder-custom-forms,"Enhance your online store with our FormCRM: AI Form Builder & CRM! Design custom, theme-friendly forms for contact, feedback, surveys, and refunds.",2025-04-22 00:03:10+00:00,"Google SMTP,Mailchimp,SendGrid,Customer Creation,Google reCaptcha,Google Sheets"
4997358,Shopzon Bundle Quantity Breaks - Best Product Bundle App Shopify,https://apps.shopify.com/shopzon-product-bundles,Shopzon Product Bundles allows you to create bundles and volume discounts to enhance your average order value.,2025-04-22 00:03:34+00:00,Checkout
2883673,Commission Factory - Grow your sales with affiliates and influencers,https://apps.shopify.com/commission-factory,"Connect with bloggers, influencers, price comparison sites and many other digital partners who can promote your products to their engaged audiences...",2025-04-22 00:03:40+00:00,Checkout
6050145,Quick Upsell‑‑Mini Cart Drawer - Quick Upsell Mini Cart Drawer - InCart Widgets & Discounts,https://apps.shopify.com/quick-upsell,"Drag and drop customizable InCart page builder that fit your theme. Shopify, Custom discounts, Free gift, Free shipping with purchase cart upsells Quick Upsell.",2025-04-22 00:03:47+00:00,"Rivyo,Stamped.io,Loox,Judge.me,Hextom: Translate & Currency,Ryviu"
6272572,Sticky Cart: Slide Cart Drawer - BOOST SALES w a Slide Kart  & Upsell Side Cart...,https://apps.shopify.com/kaktus-in-cart,"With the shopping cart app, you can level up cart to a sticky cart Shopify instead of the default store cart. The cart drawer Shopify helps you to ...",2025-04-22 00:03:56+00:00,Checkout
5380900,"Fontify: Google & Custom Fonts - Change any Google fonts, Custom Fonts easily for your store",https://apps.shopify.com/fontify-change-customize-font-for-your-store,Fontify is a quick font changer app for Shopify stores. Apply any Google font & Custom fonts instantly for your webpages.,2025-04-22 00:04:14+00:00,"ecomposer,loox,yotpo,the4,ryviu,layouthub"
5428141,Diatome - secondhand branded resale solution,https://apps.shopify.com/diatome,Branded resale solution for forward-thinking brands,2025-04-22 00:04:21+00:00,"Brevo,Mondial Relay"
3566494,CRO ‑ Insert Code - Insert Code - Add Custom Code to Header & Footer,https://apps.shopify.com/insert-header-footer-script,"Insert facebook pixels, search console code, google analytics code, Insert HTML, CSS, Liquid, JQuery, and Javascript with insert code header footer app.",2025-04-22 00:04:28+00:00,"<head>,head,header,google tag manager,Insert code,code"
7273073,"POWR: Link‑in‑Bio - POWR: Link-in-Bio, Linktree alternative for Shopify",https://apps.shopify.com/powr-link-in-bio,"Improve your eCommerce store with Linktree alternative, POWR: Link-in-Bio. The easy way to connect & share social channels with visitors. No coding required.",2025-04-22 00:04:37+00:00,"YouTube,Instagram,Twitter,Facebook,TikTok,WhatsApp"
8665279,Mehrwegversand,https://apps.shopify.com/reusable-shipping-hey-circle,App für das hey circle Mehrweg-Versandsystem · Auswahl zwischen Einweg- und Mehrwegverpackungen im Checkout · Pfandabwicklung durch hey circle,2025-04-22 00:04:56+00:00,hey circle cloud
9665086,EXPORT OrderPro: Order reports - Export Orders Report for shopify with automation,https://apps.shopify.com/export-orders,EXPORT OrderPro takes data from your store's daily sales and generates order reports easily customized to fit your business process. Choose from mo...,2025-04-22 00:05:03+00:00,"FTP,Product Customizer,e-mail"
9544634,"Nordic Shipping Options - Offer pickup points from GLS, Bring, Postnord and dao",https://apps.shopify.com/nordic-shipping-options,Parcelshops and pickup points are the most popular shipping option in several countries - and now you can easily offer it to your customers.,2025-04-22 00:05:18+00:00,"PostNord,drop shipping,Bring,YourGls,dao,GLS"
6931799,Crowdin - Automate translation & localization of all your content,https://apps.shopify.com/crowdin,"No need to upload translated files manually to Shopify. Automate updates of source content and translations to save your time with Crowdin.
Send co...",2025-04-22 00:05:27+00:00,"Marketo,Klaviyo,Google Drive,GitHub,Mailchimp,Intercom"
3904910,Push Lap Growth ‑ Affiliate - Affiliate Tracking & Payouts for Shopify,https://apps.shopify.com/push-lap-growth,"Create an Affiliate Program for your Shopify store. Track referrals, manage commissions, and pay affiliates via PayPal, Wise, or bank transfers.",2025-04-22 00:05:46+00:00,"Paddle,Chargebee,Checkout,Wise,Mailerlite,Stripe,Paypal"
2611904,SKU Manager,https://apps.shopify.com/sku-manager,"Automate SKU & Barcode creation, detect duplicates, and customize effortlessly. Easily undo any changes.",2025-04-22 00:05:51+00:00,2048 Variants
5028002,Swipper product image carousel,https://apps.shopify.com/product-slider-carousel,"Revolutionize your online store with Swipper app! Explore 1:1 touch interaction, a diverse template collection, and seamless Shopify 2.0 integratio...",2025-04-22 00:05:57+00:00,"Product carousel,Online store 2.0"
7860230,Mailjet Email by Combidesk - One Solution To Power Your Email,https://apps.shopify.com/mailjet-connector,"With Combidesk and this Mailjet integration, you'll no longer have to copy data from one system to the other. This means making fewer mistakes and ...",2025-04-22 00:06:13+00:00,"privy,mailjet"
5638699,teelaunch: Print on Demand - Maximize Sales and Boost your Profits with Print on Demand,https://apps.shopify.com/teelaunch-1,"We handle every step: printing, packaging, and global shipping, freeing you to focus on creativity and business growth. Our commitment to quality s...",2025-04-22 00:06:19+00:00,"Etsy,Customily"
1358649,"Invoice Falcon - Generate tax compliant PDF invoices, receipts, packing slips.",https://apps.shopify.com/invoice-falcon,"Easily print and send invoices from your Order Admin Dashboard. Keep a tab on your paid, unpaid, partially paid invoices. Manage invoices, billing ...",2025-04-22 00:06:31+00:00,"Shopify POS,Order Delivery Date,Wholesale Gorilla,Exemptify"
7969657,"Dr Stacked Discounts on Cart - Dr Stacked Discounts on Cart, Multiple Stacked Discounts",https://apps.shopify.com/discount-on-cart-pro,"Accept Discount Codes on Cart, Stack Discounts, Multiple Automatic Discounts + Coupon Code Promotion",2025-04-22 00:06:38+00:00,"Variant Option Product Options,Shop Pay Checkout,Checkout"
8529614,Bizrate Insights Reviews - Gather feedback. Gain powerful insight. Boost your business.,https://apps.shopify.com/bizrate-insights-voc-feedback,"With Bizrate Insights, you can launch voice-of-customer surveys that give you a 360-degree understanding of every shopper journey and each individu...",2025-04-22 00:06:46+00:00,Checkout
