api_key,app_name,app_store_url,app_details,app_submission_created_at,integrations
3181082,SpurIT Wholesale Pricing - Transform your retail store into a wholesale store easily,https://apps.shopify.com/wholesale-pricing-membership-manager,"Manage your wholesale store and memberships with ease using this all-in-one wholesale app!

Set up membership groups with automatic tagging, email ...",2025-04-22 02:06:40+00:00,Customer accounts
1357570,"Llama Upsells - Drive store profits with custom cart, upsells & offers",https://apps.shopify.com/upsell-prod,"Send personalized in-cart upsells, cross-sells, and automated offers to the right shopper at the right time to increase conversions, order value, and profit.",2025-04-22 02:07:09+00:00,Checkout
9136347,Conversell AI Chatbot - Conversell AI Chatbot,https://apps.shopify.com/voice-shopping-applications-builder,Conversell: Your All-in-One Virtual Assistant for E-commerce Success,2025-04-22 02:07:51+00:00,"WhatsApp,Facebook Messenger,Instagram,Amazon Alexa"
5783011,"Trustoo Ali Reviews Importer - Easily import reviews from AliExpress, Shopee, DSers and Etsy.",https://apps.shopify.com/tt-reviewimport,"Channelwill Trustoo.io quickly collect reviews from AliExpress and export them.
Support multiple languages, 7*24 hours service....",2025-04-22 02:08:16+00:00,Shopify Flow
7118425,Normalize Gift Wrap & Message - Add gift and message option on product page,https://apps.shopify.com/normalize-gift-wrap-message,"Allow customers to easily add gift wrap, gift notes, gift messages, and personalized gift options from the product page to checkout. These features...",2025-04-22 02:08:24+00:00,Checkout
7908003,Browsee - Don't lose on Revenue. Understand Why Visitors Dropped.,https://apps.shopify.com/browsee,"Browsee is your smart assistant for visual user insights, helping you understand customer behavior, identify pain points, and enhance their experi...",2025-04-22 02:08:34+00:00,"API,Google Analytics,Intercom,TawkTo"
9398034,Ofertia ‑ Stackable Discounts - Oferta - Descuentos flexibles y acumulables,https://apps.shopify.com/ofertia,"Con Ofertia puedes acumular y configurar diferentes ofertas y promociones en tu tienda Shopify de forma flexible, por variante, atributos, con exclusiones y por",2025-04-22 02:09:15+00:00,Checkout
3423470,"Revel Systems by Kosmos eSync - Sell items from Revel Systems. Sync Inventory, Orders +More",https://apps.shopify.com/revel-integration-by-esync,"Integrate Revel Systems point of sale to sell on more channels and manage your business more efficiently.

# Sell more products in more places
Auto...",2025-04-22 02:09:51+00:00,"eBay,Amazon,Revel Systems"
2406584,Speed Kit - Speed Kit: All-in-one Page Speed Tool,https://apps.shopify.com/speed-kit,"Speed Kit improves user experience, SEO rank, and conversion rate for high-traffic websites.",2025-04-22 02:10:02+00:00,Checkout
1755415,Zupan Inventory Counting - Zupan Inventory Counting,https://apps.shopify.com/zupan-inventory-counting-1,"Revolutionize inventory management with Zupan's powerful software. Real-time insights, streamlined operations, and total control. Get started now.",2025-04-22 02:10:11+00:00,"Quickbooks,Sage,Square,Microsoft dynamics"
2483320,Epicentr Marketplace - Epicentr Marketplace app,https://apps.shopify.com/epicentr-marketplace,Create a feed for Epicentr Marketplace (Ukraine),2025-04-22 02:10:26+00:00,"Vchasno.Kasa,Nova Poshta Shipping"
2188424,Linnworks - Linnworks,https://apps.shopify.com/linnworks,Linnworks Advanced is an inventory and order management software that will allow your business to grow at breakneck speed.,2025-04-22 02:11:11+00:00,"Magento,Amazon,BigCommerce,Walmart,eBay,WooCommerce"
9722612,Filmo - Filmo.com.au,https://apps.shopify.com/filmo,"Watch, Shop, Sell! Engage buyers & sell products in real time with Filmo's live-shopping technology. Create a seller account, link your Shopify store & go live.",2025-04-22 02:11:18+00:00,"TikTok Live,Instagram Live,Youtube Live,Facebook Live"
6946795,OMS FullComm - Orquestre seus pedidos do checkout até a entrega ao cliente,https://apps.shopify.com/integration-erp-wms-tms,"Unifique na Shopify os diversos sistemas de PDV, ERP, WMS e TMS. Utilize uma rede de operadores logísticos. Sua operação em piloto automático.",2025-04-22 02:11:43+00:00,"platinum,Intelipost,Shopify Flow,tiny,Customer accounts,omie,TOTVS,bling"
6973586,MyDepot ‑ US Dropshipping - Furniture and outdoor products from manufacturers,https://apps.shopify.com/mydepot,"#Dropshipping from Manufacturer

Everything on our website are guaranteed dropshipping from Manufacturers direct, no middle man to ensure you get b...",2025-04-22 02:11:52+00:00,"Wayfair,Amazon"
6192246,SmartBundle Quantity Breaks - Increase AOV & conversions with Quantity Breaks,https://apps.shopify.com/smartbundle,"Skyrockets your average order value by making irresistible offers customers can't refuse. Create quantity breaks, or BOGO deals that seamlessly int...",2025-04-22 02:12:42+00:00,"GemPages,PageFly,Checkout"
5272180,GentAI Bot ‑ Sales and Service - GentAI an AI Chatbot for Sales and Service,https://apps.shopify.com/gentai-bot-sales-and-service,"GentAI, an AI Chatbot for website & other channels greets visitors and converses answering business specific questions. This can cut cost of any business owner.",2025-04-22 02:12:49+00:00,"websites,store"
3934158,"AutoDS ‑ Login For Suppliers - Sell your products to 50,000+ AutoDS merchants by your rules.",https://apps.shopify.com/offer-announcement,"AutoDS for suppliers will help you to manage your relationship with other merchants and allow them to re-sell your products.
We will help you to ma...",2025-04-22 02:12:55+00:00,"CSV,Amazon,Facebook,eBay,Aliexpress"
7523309,Sellercloud - Customizable ecommerce solutions built for the way you sell,https://apps.shopify.com/sellercloud,"Sellercloud is a cloud-based omnichannel e-commerce platform. Designed to help you grow, Sellercloud has the tools and features to simplify your op...",2025-04-22 02:13:20+00:00,"Amazon,Groupon,Walmart,Overstock,eBay,NewEgg"
9938121,Blink ‑ Hide out of stock - Hide sold out or publish in-stock products automatically,https://apps.shopify.com/auto-hide-unhide-products,"Improve buying experience for your customers by hiding Products they can't buy!

The main challenge faced due to sold-out products is that customer...",2025-04-22 02:13:32+00:00,email
8608467,SourceKnowledge Shopping Ads - Reach in-market shoppers to drive new sales,https://apps.shopify.com/sourceknowledge-shopping,"SourceKnowledge helps e-commerce stores get an incremental lift in sales by turning store catalogs into shopping ads. 

Stores successfully use our...",2025-04-22 02:14:17+00:00,Checkout
9800162,Infinite Google Reviews - Showcase Google reviews with our lightweight and customizable,https://apps.shopify.com/infinitereview,"Elevate your website's credibility, trustworthiness, and social validation effortlessly with the Infinite Google Reviews app designed for Shopify. ...",2025-04-22 02:14:37+00:00,"Google,Google Maps,Google Reviews,Google Shopping,Store locator,Google My Business"
9973988,ContactPigeon Campaigns - Personalized customer engagements for Shopify,https://apps.shopify.com/contactpigeon-1,"Connect your Shopify store to attract, convert, and retain your online shoppers and generate more sales with the ContactPigeon customer engagement platform",2025-04-22 02:14:53+00:00,"LoyaltyLion,Instagram Ads,Meta Ads"
6466002,SPO ‑ SEO Product Optimizer - Optimize SEO for Social Media. Generate Rich Results on Google,https://apps.shopify.com/seo-product-optimizer,"SPO helps you to optimize your social share images on social media (Facebook Open Graph, Twitter Cards, Instagram DM, WhatsApp, SMS). So you can se...",2025-04-22 02:15:22+00:00,"Twitter,Bing,Facebook,Google Trends,search engine optimization,Google PageSpeed"
3981952,Pumper Bundles Quantity Breaks - Shopify Bundle Quantity Breaks App Profit Pumper,https://apps.shopify.com/pumper-quantity-breaks-product-bundles-discounts,"Customers naturally buy more items when bundles feel seamless.
Why? Because Profit Pumper's Bundle Builder helps reduce upsell resistance. That mea...",2025-04-22 02:15:30+00:00,"Post Purchase Upsell,GemPages,EasyCOD,Upcart,Page Fly,Page Builders,Checkout"
6231466,Northland Fulfillment - Canadian Ecommerce Order Fulfillment,https://apps.shopify.com/northland-fulfillment-1,Ship your ecommerce orders to the Canadian Market,2025-04-22 02:16:04+00:00,"Fedex,Loomis,UPS,Canada Post,Purolator"
2507443,parcelLab Order Tracking - Deliver a personalized embedded order tracking page,https://apps.shopify.com/parcellab-engage,"Free to install, parcelLab’s enterprise grade Order Tracking app empowers you to deliver the most personalized end-to-end post-purchase experience ...",2025-04-22 02:16:13+00:00,"Listrak,Bloomreach,Klaviyo,FlipCX,Salesforce Service Cloud,Attentive"
6019485,Angle: Store Credit Cashback - The #1 Loyalty Platform for Shopify Brands,https://apps.shopify.com/angle-loyalty,"The #1 Shopify Loyalty Platform for Premium Brands. Increase average order value by 13% with store credit rewards, digital wallet passes, and exclusive ...",2025-04-22 02:16:31+00:00,"LOOP Returns,Klaviyo,Shopify POS,Shopify Flow,Zendesk,Customer accounts,Gladly,Gorgias,Checkout"
9627722,Wix Migration App by Cart2Cart - Wix to Shopify,https://apps.shopify.com/cart2cart-wix-import,Wix to Shopify data migration,2025-04-22 02:16:47+00:00,Wix
9412924,EPA‑ Easy Product Addons - Allow customers to purchase addon products. Boost AOV,https://apps.shopify.com/spice-product-add-ons,"Compatible with Online Store 2.0

# New Feature: Apply Discounts on Addon Products. 


The Product Add-ons app is built to make the process of purc...",2025-04-22 02:17:14+00:00,online store 2
2498118,Moneybird - Your webshop orders effortlessly in Moneybird,https://apps.shopify.com/moneybird,"This app connects your Shopify webshop to your Moneybird administration. That’s why you don’t have to manually type out data, since the orders are ...",2025-04-22 02:17:20+00:00,Moneybird
2708721,DiscoHunt ‑ Tiered free gifts - Shopify multiple free gifts,https://apps.shopify.com/discohunt,Tiered free gifts app for Shopify store,2025-04-22 02:17:37+00:00,Checkout
7889773,"HidePay: Hide Payment Methods - HidePay: Hide, Sort & Rename Payment Methods",https://apps.shopify.com/hidepay,"With HidePay you can easily hide, sort & rename certain payment methods during checkout, reducing the risk of chargebacks, unwanted high taxes and shipping fee",2025-04-22 02:17:43+00:00,Checkout
8452764,Singleton,https://apps.shopify.com/simple-customers-discount-club,Create volume or another auto discounts for your customers. Create wholesale customers or B2B partners groups with special products prices. Increase your sales!,2025-04-22 02:17:52+00:00,Checkout
9896239,Genie: Inventory Management - Genie: Inventory Management for Shopify Brands,https://apps.shopify.com/genie-io,"With Genie Shopify brands can create purchase orders, track their inventory and plan for the future. Get started with inventory management in minutes.",2025-04-22 02:18:09+00:00,"Bundles,Multi Locations,POS,Returns Apps,Bundle Builder Apps,3PLs"
7435944,"Fordeer: PreOrder Now PreSale - Pre-Order with badges, partial payments & back in stock emai",https://apps.shopify.com/preorder-now-presale-fordeer,PreOrder Now PreSale & Fordeer: Increase your website's revenue by selling products even when they’re out of stock.,2025-04-22 02:18:17+00:00,Product Labels
1879713,VStore Shoppable Videos - VStore Shoppable Videos,https://apps.shopify.com/vstore-media,"Make your videos ""Shoppable"" so viewers can view products in real-time and buy directly from your video!",2025-04-22 02:18:26+00:00,rBux
9905574,FlexOffers Affiliate Marketing - Simple Affiliate Marketing with Affiliates and Influencers,https://apps.shopify.com/flexoffers-affiliate-marketing,"The FlexOffers.com App is easy to install and allows you to track and manage partners (also known as affiliates, publishers, influencers, ambassadors).",2025-04-22 02:18:42+00:00,Checkout
2670211,SEON Fraud Prevention - Fraud Detection & Prevention Software for Shopify,https://apps.shopify.com/seon-fraud-detection-and-prevention,"SEON fraud detection and prevention software reduce the costs of fraud. Identify fake accounts, slash manual reviews, and reduce chargebacks today!",2025-04-22 02:19:10+00:00,"Upsell apps and many more,Shop Pay, Stripe, Chargeflow,CyberSource, Klarna, PayPal,Authorize.net, Braintree,Adyen, Affirm, Afterpay,Recharge, Bold Subscriptions,Checkout"
3917809,Appstle℠ Loyalty & Rewards,https://apps.shopify.com/appstle-loyalty,"A powerful built-for Shopify loyalty app offering points, store credits, rewards, referrals & VIP program to boost customer retention. With 24x7x365 support.",2025-04-22 02:19:20+00:00,"Seal, Bold, Recurpay,Klaviyo, Omnisend,Loox Reviews, Product Reviews,Recharge, Yotpo Subscriptions,Shopify POS,Shopify Flow,Customer accounts,Mailchimp, Stamped IO,Judge.Me, Appstle Subscription,Checkout"
9613726,Zoho Packages - Zoho Packages,https://apps.shopify.com/zoho-packages,"Zoho packages is a Shopify app built for merchants with functionality to synchronize their customers, products and orders in Zoho CRM using manual/Automatic.",2025-04-22 02:19:28+00:00,Zoho CRM
9617434,Zoho Sheets Tools - Shopify automation and workflows,https://apps.shopify.com/zoho-sheets-tools,Effortlessly manage and analyze your Shopify data with Zoho Sheets.,2025-04-22 02:19:56+00:00,Zoho Sheets
6292644,Commslayer ‑ Helpdesk & Chat - Helpdesk & chat by the ex-Lifetimely founders,https://apps.shopify.com/commslayer,"Hey, Karri the founder here. I built this helpdesk because other support tools weren't improving much, but their prices kept climbing.

It connects...",2025-04-22 02:20:36+00:00,"Instagram,Office 365,Facebook,Shopify Flow,Aircall,Gmail"
4426078,Quizify ‑ Product Quiz Builder - Quizify - Quiz Builder Shopify App,https://apps.shopify.com/quizify-product-quiz-feedback,"Use Quizify app to create your personalize product recommendation Quiz that can increase your leads, improve your revenue up to 2X and gain customer insights.",2025-04-22 02:20:52+00:00,"Judge.me, Trustoo, Loox,ActiveCampaign, Omnisend,Google Analytics, FB Pixel,Zapier, Make.com,Recharge, Appstle, Seal, Yotpo,Mailchimp, Klaviyo, Brevo"
1596882,Return Helper: Return Centre - Automate Returns through a Branded Portal and 15+ Warehouses,https://apps.shopify.com/returnhelper-return-centre,Return Helper is a comprehensive return management solution designed to streamline and optimize the return process and aftermarket activities for retailers.,2025-04-22 02:21:36+00:00,"Sagawa Express,USPS,DPD,Australia Post,UPS,Canada Post"
3816517,Hura Video Gallery - Display YouTube video gallery in a grid view on your...,https://apps.shopify.com/hura-video-gallery,Hura Video Gallery helps you display YouTube videos (from a channel or a playlist) in a grid view on your store. It is designed for simplicity. You...,2025-04-22 02:21:42+00:00,Youtube
4146966,WT QR Code Generator - WT QR Code Generator - QR Codes for Products &...,https://apps.shopify.com/wt-qrcode-generator,Generate customizable QR codes for your Store products and collections with the WT QR Code Generator. Enhance customer experience and track performance.,2025-04-22 02:22:06+00:00,"Store Collections,Store Products"
1479441,Octolize Distance Based Rates - Distance based delivery rates and shipping cost Shopify app,https://apps.shopify.com/octolize-distance-based-rates,Provide your Shopify store customers with accurate shipping cost and delivery rates based on distance calculated with Google Maps driving route or straight line,2025-04-22 02:22:15+00:00,"Carrier Service API,Google Maps"
3768286,EG Auto Add to Cart Free Gift  - Auto Add Gifts with Purchase & Upsells with EG,https://apps.shopify.com/gifter-cart-auto-include,"EG Auto Add to Cart makes Free GWP, BOGOs & Upsell promos easy to run. Helping you boost AV and conversion rates.",2025-04-22 02:22:21+00:00,"Cartix,ReCharge,Checkout"
2096975,Latch ‑ Member Exclusives - Latch – Lock Products for Members & Upsell Memberships,https://apps.shopify.com/member-lock,"Secure products for members, upsell memberships, and track revenue growth with Latch. Enhance your store’s shopping experience and increase sales.",2025-04-22 02:22:54+00:00,Checkout
9121927,Sellify Post Purchase Upsell - Sellify post purchase upsell,https://apps.shopify.com/sellify,Boost AOV with One-Click Upsells: Post-Purchase & Thank You Page Upsells. Increase conversions & revenue effortlessly with seamless upsell offers.,2025-04-22 02:23:08+00:00,Checkout
4862822,Nada,https://apps.shopify.com/nada-sort-hide-out-of-stock,"Nada helps your store stay organized and well-stocked. Automatically hide or move sold-out products, and get low stock alerts.",2025-04-22 02:23:16+00:00,email
3149323,Discounty: Bulk Discount Sales - Discounty Shopify App: Boost Sales with Discount Campaigns,https://apps.shopify.com/discounty-bulk-discount-sales,"Increase your Shopify store sales with Discounty. Unlimited discount campaigns, bulk discounts, quantity-based offers, discounted pricing, and tiered discount.",2025-04-22 02:23:25+00:00,"Sales badge on different theme,Themes & Style,Fast Bundle: Bundles Discounts,Notify! Back in Stock|PreOrder,PageFly Landing Page Builder,Checkout"
8378263,eCard Widget ‑ Gift Notes - eCardWidget - Digital eCards for Shopify Stores,https://apps.shopify.com/share-branded-ecards-invites,Boost engagement with eCardWidget! Customers send branded digital eCards. Seamlessly integrate with Shopify for personalized greetings.,2025-04-22 02:23:50+00:00,"Wix,Cross-Platform,Everywhere,Squarespace,Customer accounts,HTML5,Wordpress,Checkout"
5644693,ReportGarden - ReportGarden helps marketing agencies automate their reports,https://apps.shopify.com/reportgarden,"ReportGarden helps digital marketing agencies and in-house marketing teams to create simple, beautiful marketing reports. ReportGarden comes with a...",2025-04-22 02:23:59+00:00,"Google,Instagram,Microsoft,Twitter,Facebook,LinkedIn"
2848724,F: B2B VAT: Display Dual Price - Validate VAT ID for Shopify stores in the Europe,https://apps.shopify.com/dual-price-display-tax,Validate VAT ID and show price excluding or including tax accordingly.,2025-04-22 02:24:15+00:00,"EU GDPR,Dropshipping,Cookie Banner,B2B Wholesale App,Checkout"
2204987,IC:Frequently Bought Together  - Frequently Bought Together,https://apps.shopify.com/push-to-buy-more,"Frequently Bought Together: See what customers add & save on bundles! 
Shop Smarter: Browse related items for a perfect combo.",2025-04-22 02:24:28+00:00,"product reviews,stamped.io reviews,jugde.me reviews,yotpo reviews,loox reviews,ali reviews"
1761016,Obviyo Checkout Zen - Benchmark your cart and checkout in one automated dashboard,https://apps.shopify.com/checkout-zen,Obviyo Checkout Zen compares metrics from all other sites to calculate your own checkout score. It’s a credit score like number that shows you how ...,2025-04-22 02:24:34+00:00,Checkout
4337518,Official TCS Courier App - Effortlessly manage orders and track shipments in one app.,https://apps.shopify.com/tcscourier,"This is unique to our business since it will enable our merchants to deliver more items and process orders more quickly, especially if they receive...",2025-04-22 02:24:42+00:00,TCS API
8688698,"LDT: Gift Wrap, Gift Message - Add gift wrap, add-on, message option to your store front.",https://apps.shopify.com/ldt-gift-wrap,"With our gifting solution, you can elevate your customer shopping experience with seamless gift options, including Gift Wrapping, Gift Options, Gre...",2025-04-22 02:25:15+00:00,"Shipstation/3PL/ERP,Cart drawer/slider,Product Page,Cart page,Theme Editor,Checkout Extensions,Checkout"
2867822,Recently Viewed ‑ Pasilobus - Recently Viewed Products – Enhance Storefront Engagement,https://apps.shopify.com/recently-viewed-pasilobus,Display customers' recently viewed items on your storefront and account pages. Gain insights into browsing behavior to boost conversions.,2025-04-22 02:25:20+00:00,Customer accounts
6707880,FeeBee ‑ Fees and Deposits - Easily add fees and surcharges to your products and cart.,https://apps.shopify.com/feebee,Füge mit der App FeeBee Gebühren und Pfand zu deinen Shopify-Store hinzu. Ideal für alle Branchen. Jetzt kostenlos testen!,2025-04-22 02:25:26+00:00,"POS,Checkout"
4155653,Monitor Pinterest Tag - One-click Pinterest Pixel Installer & Conversion Tracking,https://apps.shopify.com/pinterest-multipixels,Our app allows you to get the most of your Pinterest ads. You will be able to install your Pinterest Tag into your store with one clicks. You can t...,2025-04-22 02:26:27+00:00,"Pinterest Pixel,Pinterest Pixels,Pinterest Pixels tag,Pinterest tag,Pinterest tag Pixel,Pixel Pinterest"
5125373,BBD ‑ Big Bulk Discount - Volume Or Tier Discount - Boost Sales With Discounts,https://apps.shopify.com/big-bulk-discount,Volume or Tier discounts on products and collections. Create volume discounts manually or one by one from app dashboard,2025-04-22 02:26:42+00:00,Checkout
5119896,"PowerUP Retail - PowerUP Retail – Forms, Tasks, Checklists for Shopify POS",https://apps.shopify.com/powerup-retail,"Supercharge in-store operations with PowerUP Retail for Shopify POS. Track daily operations, onboard employees, and boost team performance—all for free.",2025-04-22 02:26:58+00:00,Shopify POS
2323239,Address Guard ‑ Validator - Shipping Address verification powered by Address Guard,https://apps.shopify.com/wrong-address-checker,"Customers will often mistype shipping addresses, emails & phone numbers with their online order, leading to communication issues and carrier fees.",2025-04-22 02:27:03+00:00,"Webhooks,Checkout,Zapier,Tapcart,Shopify Flow,Attentive,Gorgias,Flow"
1876888,GrowCommerce Pixel Tag Manager - Complete Google Analytics 4 & Google Ads Conversion Tracking,https://apps.shopify.com/growcom-google-analytics-4,"Achieve comprehensive eCommerce tracking and precisely monitor site behavior and conversions in Google Analytics 4, Google Ads and Facebook Pixel using GTM.",2025-04-22 02:27:13+00:00,"Facebook Pixel Tracking,Google Analytics 4,TikTok Pixel Tracking,Google Ads,Google Tag Manager,Bing Ads Tracking"
1792445,Simple Inventory Alerts - Multi-Channel inventory alerts for shop owners,https://apps.shopify.com/simple-inventory-alerts,Simple Inventory Alerts notifies you (the shop owner) as soon as one of your products is out if stock. You can configure an individual threshold pe...,2025-04-22 02:27:29+00:00,"Discord,Pushover,Slack,Telegram"
5274777,S: Promotions and Upsells - Simple Promotions and Upsells for Shopify,https://apps.shopify.com/simple-promotions-and-upsells,Simple Promotions and Upsells is simple and effective post-purchase offers and a 1-click upsell app.,2025-04-22 02:28:06+00:00,"POS,Mobile,Online Store 2.0,Post Purchase Offers,Thank You Page Offers,Checkout"
7319300,Aco ‑ Product Options & Addons - Shopify Product Options and Addons,https://apps.shopify.com/product-options-addons,Add custom product options using drag-and-drop form builder for Shopify Store,2025-04-22 02:28:31+00:00,"Shopify POS,Checkout"
3775319,Flash Stock - Flashstock,https://apps.shopify.com/flash-stock,Cart Timer & Inventory Control Elevate Conversions.,2025-04-22 02:28:39+00:00,Checkout
2359458,Seamlessly Auction - Run Product Auctions in Shopify,https://apps.shopify.com/seamless-auction,"Seamless Auction - Create and manage auctions from within Shopify with endless functionality, customization, and automation",2025-04-22 02:28:45+00:00,"SMTP,Outlook,Gmail"
8114677,Quiz Kit: AI Product Finder - Quiz Kit App: AI Product Quiz Builder,https://apps.shopify.com/quiz-kit,"Create high-converting quizzes on Shopify to boost sales, grow your email & SMS list, and personalize product recommendations. Easy AI setup, no code required!",2025-04-22 02:29:03+00:00,"Google Analytics,Yotpo,Klaviyo,Omnisend,Shopify Flow,Facebook Pixel,ReCharge,Checkout"
9246313,"OPTIS Product Options, Variant - Product Options & Variants Options",https://apps.shopify.com/product-options-by-bss,"Enable unlimited product options and variants with custom options, color swatches, and text boxes. Use conditional logic to personalize products and boost sales",2025-04-22 02:29:53+00:00,"B2B/Wholesale Solution,Pagefly,Checkout"
2136047,Shipfusion Order Fulfillment - Scalable fulfillment to power your fast-growing DTC brand.,https://apps.shopify.com/shipfusion,Shipfusion’s native integration provides seamless order fulfillment that keeps up with drastic changes in order volumes – without compromising on o...,2025-04-22 02:30:02+00:00,"Skubana,Amazon,SPS Commerce,Netsuite,Walmart,Loop Returns"
7665712,"Webkul Restaurant Management - Real Time Availability of Table Booking, using POS",https://apps.shopify.com/restaurant-table-management,"Are you a restaurant owner and using shopify POS? If yes, then the app is suitable for your needs. Webkul Restaurant Management app will help manag...",2025-04-22 02:30:14+00:00,Shopify POS
6502103,"BundleJoy: Packs & Boxes - BundleJoy – Create bundles, boxes and kits",https://apps.shopify.com/bundlejoy,"Create personalized bundle boxes, bundles, and kits",2025-04-22 02:30:24+00:00,Checkout
7918029,CartFields for POS - CartFields - add custom fields for Shopify POS checkout,https://apps.shopify.com/cart-fields-pos-checkout,Add custom fields to the cart and products in your Shopify POS checkout. Staff can collect relevant data to extended order details on the invoice.,2025-04-22 02:30:37+00:00,Shopify POS
